,,,,,,,,,,,,,,,,California Water Service,,East Bay Municipal Utilities District,East Bay Municipal Utilities ,East Bay Municipal Utilities ,East Bay Municipal Utilities ,East Bay Municipal Utilities ,East Bay Municipal Utilities ,East Bay Municipal Utilities ,East Bay Municipal Utilities ,East Bay  Utilities ,East Bay  Utilities ,East Bay  Utilities ,East Bay   ,East Bay   ,East Bay   ,East Bay   ,East Bay   ,East Bay   ,East Bay   ,East Bay   Morro Bay  City of,Morro Bay  City of,Morro Bay  ,Morro Bay  ,Morro Bay  ,Morro Bay  ,Morro Bay  ,Morro Bay  ,Morro Bay  ,Morro Bay  ,Morro Bay  ,Morro Bay  ,Morro Bay  ,Morro Bay  ,Morro Bay  ,Morro Bay  ,Morro Bay  ,Morro Bay  ,Morro Bay  Yorba Linda Water District,Yorba Linda Water ,Yorba Linda Water ,Yorba Linda  ,Yorba Linda  ,Yorba Linda  ,Yorba Linda  ,Yorba Linda  ,Yorba Linda  ,Yorba Linda  ,Yorba Linda  ,Yorba Linda  ,Yorba Linda  ,Yorba Linda  ,Yorba Linda  ,Yorba Linda  ,Yorba Linda  ,Yorba Linda  ,Yorba Linda  California City  City of,California City  City of,California City  ,California City  ,California City  ,California City  ,California City  ,California City  ,California City  ,California City  ,California City  ,California City  ,California City  ,California City  ,California City  ,California City  ,California City  ,California City  ,California City  Long Beach  City of,Long Beach  City of,Long Beach  ,Long Beach  ,Long Beach  ,Long Beach  ,Long Beach  ,Long Beach  ,Long Beach  ,Long Beach  ,Long Beach  ,Long Beach  ,Long Beach  ,Long Beach  ,Long Beach  ,Long Beach  ,Long Beach  ,Long Beach  ,Long Beach  "Los Banos, City of","Los Banos, City of","Los Banos, ","Los Banos, ",Los Banos ,Los Banos ,Los Banos ,Los Banos ,Los Banos ,Los Banos ,Los Banos ,Los Banos ,Los Banos ,Los Banos ,Los Banos ,Los Banos ,Los Banos ,Los Banos ,Los Banos Turlock  City of,Turlock  City of,Turlock  ,Turlock  ,Turlock  ,Turlock  ,Turlock  ,Turlock  ,Turlock  ,Turlock  ,Turlock  ,Turlock  ,Turlock  ,Turlock  ,Turlock  ,Turlock  ,Turlock  ,Turlock  ,Turlock  Jurupa Community Service District,Jurupa Community Service ,Jurupa Community Service ,Jurupa Community Service ,Jurupa Community Service ,Jurupa  Service ,Jurupa  Service ,Jurupa  Service ,Jurupa  Service ,Jurupa  Service ,Jurupa  Service ,Jurupa  Service ,Jurupa  Service ,Jurupa  Service ,Jurupa  Service ,Jurupa  Service ,Jurupa  Service ,Jurupa  Service ,Jurupa  Service Coastside County Water District,Coastside County Water ,Coastside County Water ,Coastside County  ,Coastside County  ,Coastside County  ,Coastside   ,Coastside   ,Coastside   ,Coastside   ,Coastside   ,Coastside   ,Coastside   ,Coastside   ,Coastside   ,Coastside   ,Coastside   ,Coastside   ,Coastside   Citrus Heights Water District,Citrus Heights Water ,Citrus Heights Water ,Citrus Heights  ,Citrus Heights  ,Citrus Heights  ,Citrus Heights  ,Citrus Heights  ,Citrus Heights  ,Citrus Heights  ,Citrus Heights  ,Citrus Heights  ,Citrus Heights  ,Citrus Heights  ,Citrus Heights  ,Citrus Heights  ,Citrus Heights  ,Citrus Heights  ,Citrus Heights  Burlingame  City of,Burlingame  City of,Burlingame  ,Burlingame  ,Burlingame  ,Burlingame  ,Burlingame  ,Burlingame  ,Burlingame  ,Burlingame  ,Burlingame  ,Burlingame  ,Burlingame  ,Burlingame  ,Burlingame  ,Burlingame  ,Burlingame  ,Burlingame  ,Burlingame  Orange Vale Water Company,Orange Vale Water Company,Orange Vale Water Company,Orange Vale  Company,Orange Vale  Company,Orange Vale  Company,Orange Vale  Company,Orange Vale  Company,Orange Vale  Company,Orange Vale  ,Orange Vale  ,Orange Vale  ,Orange Vale  ,Orange Vale  ,Orange Vale  ,Orange Vale  ,Orange Vale  ,Orange Vale  ,Orange Vale  Dublin San Ramon Services District,Dublin San Ramon Services ,Dublin San Ramon Services ,Dublin San Ramon Services ,Dublin San Ramon Services ,Dublin San Ramon Services ,Dublin San Ramon Services ,Dublin San Ramon Services ,Dublin San Ramon Services ,Dublin San Ramon Services ,Dublin San Ramon Services ,Dublin San Ramon Services ,Dublin San Ramon Services ,Dublin San Ramon Services ,Dublin San Ramon Services ,Dublin San Ramon  ,Dublin San Ramon  ,Dublin San Ramon  ,Dublin San Ramon  Los Angeles Department of Water and Power,Los Angeles Department of Water and Power,Los Angeles Department of Water and Power,Los Angeles Department of  and Power,Los Angeles Department of  and Power,Los Angeles Department of  and Power,Los Angeles Department of  and Power,Los Angeles Department of  and Power,Los Angeles Department of  and Power,Los Angeles Department of  and Power,Los Angeles Department of  and Power,Los Angeles Department of  and Power,Los Angeles Department of  and Power,Los Angeles Department of  and Power,Los Angeles Department of  and Power,Los Angeles Department of  and Power,Los Angeles Department of  and Power,Los Angeles Department of  and Power,Los Angeles Department   and PowerCamrosa Water District,Camrosa Water ,Camrosa Water ,Camrosa  ,Camrosa  ,Camrosa  ,Camrosa  ,Camrosa  ,Camrosa  ,Camrosa  ,Camrosa  ,Camrosa  ,Camrosa  ,Camrosa  ,Camrosa  ,Camrosa  ,Camrosa  ,Camrosa  ,Camrosa  El Dorado Irrigation District,El Dorado Irrigation ,El Dorado Irrigation ,El Dorado Irrigation ,El Dorado Irrigation ,El Dorado Irrigation ,El Dorado Irrigation ,El Dorado  ,El Dorado  ,El Dorado  ,El Dorado  ,El Dorado  ,El Dorado  ,El Dorado  ,El Dorado  ,El Dorado  ,El Dorado  ,El Dorado  ,El Dorado  El Centro  City of,El Centro  City of,El Centro  ,El Centro  ,El Centro  ,El Centro  ,El Centro  ,El Centro  ,El Centro  ,El Centro  ,El Centro  ,El Centro  ,El Centro  ,El Centro  ,El Centro  ,El Centro  ,El Centro  ,El Centro  ,El Centro  Milpitas  City of,Milpitas  City of,Milpitas  ,Milpitas  ,Milpitas  ,Milpitas  ,Milpitas  ,Milpitas  ,Milpitas  ,Milpitas  ,Milpitas  ,Milpitas  ,Milpitas  ,Milpitas  ,Milpitas  ,Milpitas  ,Milpitas  ,Milpitas  ,Milpitas  Santa Rosa  City of,Santa Rosa  City of,Santa Rosa  ,Santa Rosa  ,Santa Rosa  ,Santa Rosa  ,Santa Rosa  ,Santa Rosa  ,Santa Rosa  ,Santa Rosa  ,Santa Rosa  ,Santa Rosa  ,Santa Rosa  ,Santa Rosa  ,Santa Rosa  ,Santa Rosa  ,Santa Rosa  ,Santa Rosa  ,Santa Rosa  Westminster  City of,Westminster  City of,Westminster  ,Westminster  ,Westminster  ,Westminster  ,Westminster  ,Westminster  ,Westminster  ,Westminster  ,Westminster  ,Westminster  ,Westminster  ,Westminster  ,Westminster  ,Westminster  ,Westminster  ,Westminster  ,Westminster  Poway  City of,Poway  City of,Poway  ,Poway  ,Poway  ,Poway  ,Poway  ,Poway  ,Poway  ,Poway  ,Poway  ,Poway  ,Poway  ,Poway  ,Poway  ,Poway  ,Poway  ,Poway  ,Poway  Mid-Peninsula Water District,Mid-Peninsula Water ,Mid-Peninsula Water ,Mid-Peninsula  ,Mid-Peninsula  ,Mid-Peninsula  ,Mid-Peninsula  ,Mid-Peninsula  ,Mid-Peninsula  ,Mid-Peninsula  ,Mid-Peninsula  ,Mid-Peninsula  ,Mid-Peninsula  ,Mid-Peninsula  ,Mid-Peninsula  ,Mid-Peninsula  ,Mid-Peninsula  ,Mid-Peninsula  ,Mid-Peninsula  Olivenhain Municipal Water District,Olivenhain Municipal Water ,Olivenhain Municipal Water ,Olivenhain Municipal  ,Olivenhain Municipal  ,Olivenhain Municipal  ,Olivenhain Municipal  ,Olivenhain Municipal  ,Olivenhain   ,Olivenhain   ,Olivenhain   ,Olivenhain   ,Olivenhain   ,Olivenhain   ,Olivenhain   ,Olivenhain   ,Olivenhain   ,Olivenhain   ,Olivenhain   San Diego  City of,San Diego  City of,San Diego  ,San Diego  ,San Diego  ,San Diego  ,San Diego  ,San Diego  ,San Diego  ,San Diego  ,San Diego  ,San Diego  ,San Diego  ,San Diego  ,San Diego  ,San Diego  ,San Diego  ,San Diego  ,San Diego  Daly City  City of,Daly City  City of,Daly City  ,Daly City  ,Daly City  ,Daly City  ,Daly City  ,Daly City  ,Daly City  ,Daly City  ,Daly City  ,Daly City  ,Daly City  ,Daly City  ,Daly City  ,Daly City  ,Daly City  ,Daly City  ,Daly City  San Lorenzo Valley Water District,San Lorenzo Valley Water ,San Lorenzo Valley Water ,San Lorenzo Valley  ,San Lorenzo Valley  ,San Lorenzo Valley  ,San Lorenzo Valley  ,San Lorenzo Valley  ,San Lorenzo Valley  ,San Lorenzo Valley  ,San Lorenzo Valley  ,San Lorenzo Valley  ,San Lorenzo Valley  ,San Lorenzo Valley  ,San Lorenzo Valley  ,San Lorenzo Valley  ,San Lorenzo Valley  ,San Lorenzo Valley  ,San Lorenzo Valley  Delano  City of,Delano  City of,Delano  ,Delano  ,Delano  ,Delano  ,Delano  ,Delano  ,Delano  ,Delano  ,Delano  ,Delano  ,Delano  ,Delano  ,Delano  ,Delano  ,Delano  ,Delano  ,Delano  Anaheim  City of,Anaheim  City of,Anaheim  ,Anaheim  ,Anaheim  ,Anaheim  ,Anaheim  ,Anaheim  ,Anaheim  ,Anaheim  ,Anaheim  ,Anaheim  ,Anaheim  ,Anaheim  ,Anaheim  ,Anaheim  ,Anaheim  ,Anaheim  ,Anaheim  South Tahoe Public Utilities District,South Tahoe Public Utilities ,South Tahoe Public Utilities ,South Tahoe Public Utilities ,South Tahoe Public Utilities ,South Tahoe Public Utilities ,South Tahoe Public Utilities ,South Tahoe Public Utilities ,South Tahoe Public Utilities ,South Tahoe Public Utilities ,South Tahoe  Utilities ,South Tahoe   ,South Tahoe   ,South Tahoe   ,South Tahoe   ,South Tahoe   ,South Tahoe   ,South Tahoe   ,South Tahoe   Elsinore Valley Municipal Water District,Elsinore Valley Municipal Water ,Elsinore Valley Municipal Water ,Elsinore Valley Municipal  ,Elsinore Valley Municipal  ,Elsinore Valley Municipal  ,Elsinore Valley Municipal  ,Elsinore Valley Municipal  ,Elsinore Valley   ,Elsinore Valley   ,Elsinore Valley   ,Elsinore Valley   ,Elsinore Valley   ,Elsinore Valley   ,Elsinore Valley   ,Elsinore Valley   ,Elsinore Valley   ,Elsinore Valley   ,Elsinore Valley   Coachella Valley Water District,Coachella Valley Water ,Coachella Valley Water ,Coachella Valley  ,Coachella Valley  ,Coachella Valley  ,Coachella Valley  ,Coachella Valley  ,Coachella Valley  ,Coachella Valley  ,Coachella Valley  ,Coachella Valley  ,Coachella Valley  ,Coachella Valley  ,Coachella Valley  ,Coachella Valley  ,Coachella Valley  ,Coachella Valley  ,Coachella Valley  Lake Hemet Municipal Water District,Lake Hemet Municipal Water ,Lake Hemet Municipal Water ,Lake Hemet Municipal  ,Lake Hemet Municipal  ,Lake Hemet Municipal  ,Lake Hemet Municipal  ,Lake Hemet Municipal  ,Lake Hemet   ,Lake Hemet   ,Lake Hemet   ,Lake Hemet   ,Lake Hemet   ,Lake Hemet   ,Lake Hemet   ,Lake Hemet   ,Lake Hemet   ,Lake Hemet   ,Lake Hemet   Carmichael Water District,Carmichael Water ,Carmichael Water ,Carmichael  ,Carmichael  ,Carmichael  ,Carmichael  ,Carmichael  ,Carmichael  ,Carmichael  ,Carmichael  ,Carmichael  ,Carmichael  ,Carmichael  ,Carmichael  ,Carmichael  ,Carmichael  ,Carmichael  ,Carmichael  Monte Vista Water District,Monte Vista Water ,Monte Vista Water ,Monte Vista  ,Monte Vista  ,Monte Vista  ,Monte Vista  ,Monte Vista  ,Monte Vista  ,Monte Vista  ,Monte Vista  ,Monte Vista  ,Monte Vista  ,Monte Vista  ,Monte Vista  ,Monte Vista  ,Monte Vista  ,Monte Vista  ,Monte Vista  Pleasanton  City of,Pleasanton  City of,Pleasanton  ,Pleasanton  ,Pleasanton  ,Pleasanton  ,Pleasanton  ,Pleasanton  ,Pleasanton  ,Pleasanton  ,Pleasanton  ,Pleasanton  ,Pleasanton  ,Pleasanton  ,Pleasanton  ,Pleasanton  ,Pleasanton  ,Pleasanton  ,Pleasanton  Santa Monica  City of,Santa Monica  City of,Santa Monica  ,Santa Monica  ,Santa Monica  ,Santa Monica  ,Santa Monica  ,Santa Monica  ,Santa Monica  ,Santa Monica  ,Santa Monica  ,Santa Monica  ,Santa Monica  ,Santa Monica  ,Santa Monica  ,Santa Monica  ,Santa Monica  ,Santa Monica  ,Santa Monica  Riverside  City of,Riverside  City of,Riverside  ,Riverside  ,Riverside  ,Riverside  ,Riverside  ,Riverside  ,Riverside  ,Riverside  ,Riverside  ,Riverside  ,Riverside  ,Riverside  ,Riverside  ,Riverside  ,Riverside  ,Riverside  ,Riverside  Contra Costa Water District,Contra Costa Water ,Contra Costa Water ,Contra Costa  ,Contra Costa  ,Contra Costa  ,Contra Costa  ,Contra Costa  ,Contra Costa  ,Contra Costa  ,Contra Costa  ,Contra Costa  ,Contra Costa  ,Contra Costa  ,Contra Costa  ,Contra Costa  ,Contra Costa  ,Contra Costa  ,Contra Costa  "Imperial, City of","Imperial, City of","Imperial, ","Imperial, ",Imperial ,Imperial ,Imperial ,Imperial ,Imperial ,Imperial ,Imperial ,Imperial ,Imperial ,Imperial ,Imperial ,Imperial ,Imperial ,Imperial ,Imperial California Water Service Company Antelope Valley,California Water Service Company Antelope Valley,California Water Service Company Antelope Valley,California  Service Company Antelope Valley,California  Service Company Antelope Valley,California  Service Company Antelope Valley,California  Service Company Antelope Valley,California  Service Company Antelope Valley,California  Service Company Antelope Valley,California  Service  Antelope Valley,California  Service  Antelope Valley,California  Service  Antelope Valley,California  Service  Antelope Valley,California  Service  Antelope Valley,California  Service  Antelope Valley,California  Service  Antelope Valley,  Antelope Valley,  Antelope Valley,  Antelope ValleyIrvine Ranch Water District,Irvine Ranch Water ,Irvine Ranch Water ,Irvine Ranch  ,Irvine Ranch  ,Irvine Ranch  ,Irvine Ranch  ,Irvine Ranch  ,Irvine Ranch  ,Irvine Ranch  ,Irvine Ranch  ,Irvine Ranch  ,Irvine Ranch  ,Irvine Ranch  ,Irvine Ranch  ,Irvine Ranch  ,Irvine Ranch  ,Irvine Ranch  ,Irvine Ranch  Watsonville  City of,Watsonville  City of,Watsonville  ,Watsonville  ,Watsonville  ,Watsonville  ,Watsonville  ,Watsonville  ,Watsonville  ,Watsonville  ,Watsonville  ,Watsonville  ,Watsonville  ,Watsonville  ,Watsonville  ,Watsonville  ,Watsonville  ,Watsonville  ,Watsonville  San Jose  City of,San Jose  City of,San Jose  ,San Jose  ,San Jose  ,San Jose  ,San Jose  ,San Jose  ,San Jose  ,San Jose  ,San Jose  ,San Jose  ,San Jose  ,San Jose  ,San Jose  ,San Jose  ,San Jose  ,San Jose  ,San Jose  Dinuba  City of,Dinuba  City of,Dinuba  ,Dinuba  ,Dinuba  ,Dinuba  ,Dinuba  ,Dinuba  ,Dinuba  ,Dinuba  ,Dinuba  ,Dinuba  ,Dinuba  ,Dinuba  ,Dinuba  ,Dinuba  ,Dinuba  ,Dinuba  ,Dinuba  Casitas Municipal Water District,Casitas Municipal Water ,Casitas Municipal Water ,Casitas Municipal  ,Casitas Municipal  ,Casitas Municipal  ,Casitas Municipal  ,Casitas Municipal  ,Casitas   ,Casitas   ,Casitas   ,Casitas   ,Casitas   ,Casitas   ,Casitas   ,Casitas   ,Casitas   ,Casitas   ,Casitas   Sacramento Suburban Water District,Sacramento Suburban Water ,Sacramento Suburban Water ,Sacramento Suburban  ,Sacramento Suburban  ,Sacramento Suburban  ,Sacramento Suburban  ,Sacramento Suburban  ,Sacramento Suburban  ,Sacramento Suburban  ,Sacramento Suburban  ,Sacramento Suburban  ,Sacramento Suburban  ,Sacramento Suburban  ,Sacramento Suburban  ,Sacramento Suburban  ,Sacramento Suburban  ,Sacramento Suburban  ,Sacramento Suburban  San Jose Water Company,San Jose Water Company,San Jose Water Company,San Jose  Company,San Jose  Company,San Jose  Company,San Jose  Company,San Jose  Company,San Jose  Company,San Jose  ,San Jose  ,San Jose  ,San Jose  ,San Jose  ,San Jose  ,San Jose  ,San Jose  ,San Jose  ,San Jose  Rowland Water District,Rowland Water ,Rowland Water ,Rowland  ,Rowland  ,Rowland  ,Rowland  ,Rowland  ,Rowland  ,Rowland  ,Rowland  ,Rowland  ,Rowland  ,Rowland  ,Rowland  ,Rowland  ,Rowland  ,Rowland  ,Rowland  Folsom  City of,Folsom  City of,Folsom  ,Folsom  ,Folsom  ,Folsom  ,Folsom  ,Folsom  ,Folsom  ,Folsom  ,Folsom  ,Folsom  ,Folsom  ,Folsom  ,Folsom  ,Folsom  ,Folsom  ,Folsom  ,Folsom  Chino  City of,Chino  City of,Chino  ,Chino  ,Chino  ,Chino  ,Chino  ,Chino  ,Chino  ,Chino  ,Chino  ,Chino  ,Chino  ,Chino  ,Chino  ,Chino  ,Chino  ,Chino  ,Chino  Hi-Desert Water District,Hi-Desert Water ,Hi-Desert Water ,Hi-Desert  ,Hi-Desert  ,Hi-Desert  ,Hi-Desert  ,Hi-Desert  ,Hi-Desert  ,Hi-Desert  ,Hi-Desert  ,Hi-Desert  ,Hi-Desert  ,Hi-Desert  ,Hi-Desert  ,Hi-Desert  ,Hi-Desert  ,Hi-Desert  ,Hi-Desert  "Soledad, City of","Soledad, City of","Soledad, ","Soledad, ",Soledad ,Soledad ,Soledad ,Soledad ,Soledad ,Soledad ,Soledad ,Soledad ,Soledad ,Soledad ,Soledad ,Soledad ,Soledad ,Soledad ,Soledad North Marin Water District,North Marin Water ,North Marin Water ,North Marin  ,North Marin  ,North Marin  ,North Marin  ,North Marin  ,North Marin  ,North Marin  ,North Marin  ,North Marin  ,North Marin  ,North Marin  ,North Marin  ,North Marin  ,North Marin  ,North Marin  ,North Marin  Marin Municipal Water District,Marin Municipal Water ,Marin Municipal Water ,Marin Municipal  ,Marin Municipal  ,Marin Municipal  ,Marin Municipal  ,Marin Municipal  ,Marin   ,Marin   ,Marin   ,Marin   ,Marin   ,Marin   ,Marin   ,Marin   ,Marin   ,Marin   ,Marin   Shafter  City of,Shafter  City of,Shafter  ,Shafter  ,Shafter  ,Shafter  ,Shafter  ,Shafter  ,Shafter  ,Shafter  ,Shafter  ,Shafter  ,Shafter  ,Shafter  ,Shafter  ,Shafter  ,Shafter  ,Shafter  ,Shafter  "Windsor, Town of","Windsor, Town of","Windsor, Town of","Windsor, Town of",Windsor Town of,Windsor Town of,Windsor Town of,Windsor Town of,Windsor Town of,Windsor Town of,Windsor Town of,Windsor Town of,Windsor Town of,Windsor Town of,Windsor Town of,Windsor Town of,Windsor Town of,Windsor Town of,Windsor Town Indian Wells Valley Water District,Indian Wells Valley Water ,Indian Wells Valley Water ,Indian Wells Valley  ,Indian Wells Valley  ,Indian Wells Valley  ,Indian Wells Valley  ,Indian Wells Valley  ,Indian Wells Valley  ,Indian Wells Valley  ,Indian Wells Valley  ,Indian Wells Valley  ,Indian Wells Valley  ,Indian Wells Valley  ,Indian Wells Valley  ,Indian Wells Valley  ,Indian Wells Valley  ,Indian Wells Valley  ,Indian Wells Valley  San Francisco Public Utilities Commission,San Francisco Public Utilities Commission,San Francisco Public Utilities Commission,San Francisco Public Utilities Commission,San Francisco Public Utilities Commission,San Francisco Public Utilities Commission,San Francisco Public Utilities Commission,San Francisco Public Utilities Commission,San Francisco Public Utilities Commission,San Francisco Public Utilities Commission,San Francisco  Utilities Commission,San Francisco   Commission,San Francisco   Commission,San Francisco   Commission,San Francisco   Commission,San Francisco   Commission,San Francisco   Commission,San Francisco   Commission,San Francisco   CommissionBrawley  City of,Brawley  City of,Brawley  ,Brawley  ,Brawley  ,Brawley  ,Brawley  ,Brawley  ,Brawley  ,Brawley  ,Brawley  ,Brawley  ,Brawley  ,Brawley  ,Brawley  ,Brawley  ,Brawley  ,Brawley  ,Brawley  Ontario  City of,Ontario  City of,Ontario  ,Ontario  ,Ontario  ,Ontario  ,Ontario  ,Ontario  ,Ontario  ,Ontario  ,Ontario  ,Ontario  ,Ontario  ,Ontario  ,Ontario  ,Ontario  ,Ontario  ,Ontario  ,Ontario  Huntington Beach  City of,Huntington Beach  City of,Huntington Beach  ,Huntington Beach  ,Huntington Beach  ,Huntington Beach  ,Huntington Beach  ,Huntington Beach  ,Huntington Beach  ,Huntington Beach  ,Huntington Beach  ,Huntington Beach  ,Huntington Beach  ,Huntington Beach  ,Huntington Beach  ,Huntington Beach  ,Huntington Beach  ,Huntington Beach  ,Huntington Beach  Calaveras County Water District,Calaveras County Water ,Calaveras County Water ,Calaveras County  ,Calaveras County  ,Calaveras County  ,Calaveras   ,Calaveras   ,Calaveras   ,Calaveras   ,Calaveras   ,Calaveras   ,Calaveras   ,Calaveras   ,Calaveras   ,Calaveras   ,Calaveras   ,Calaveras   ,Calaveras   Humboldt Bay Municipal Water District,Humboldt Bay Municipal Water ,Humboldt Bay Municipal Water ,Humboldt Bay Municipal  ,Humboldt Bay Municipal  ,Humboldt Bay Municipal  ,Humboldt Bay Municipal  ,Humboldt Bay Municipal  ,Humboldt Bay   ,Humboldt Bay   ,Humboldt Bay   ,Humboldt Bay   ,Humboldt Bay   ,Humboldt Bay   ,Humboldt Bay   ,Humboldt Bay   ,Humboldt Bay   ,Humboldt Bay   ,Humboldt Bay   Santa Maria  City of,Santa Maria  City of,Santa Maria  ,Santa Maria  ,Santa Maria  ,Santa Maria  ,Santa Maria  ,Santa Maria  ,Santa Maria  ,Santa Maria  ,Santa Maria  ,Santa Maria  ,Santa Maria  ,Santa Maria  ,Santa Maria  ,Santa Maria  ,Santa Maria  ,Santa Maria  ,Santa Maria  Yuba City  City of,Yuba City  City of,Yuba City  ,Yuba City  ,Yuba City  ,Yuba City  ,Yuba City  ,Yuba City  ,Yuba City  ,Yuba City  ,Yuba City  ,Yuba City  ,Yuba City  ,Yuba City  ,Yuba City  ,Yuba City  ,Yuba City  ,Yuba City  ,Yuba City  Escondido  City of,Escondido  City of,Escondido  ,Escondido  ,Escondido  ,Escondido  ,Escondido  ,Escondido  ,Escondido  ,Escondido  ,Escondido  ,Escondido  ,Escondido  ,Escondido  ,Escondido  ,Escondido  ,Escondido  ,Escondido  ,Escondido  Los Angeles County Public Works Waterworks District 29,Los Angeles County Public Works Waterworks  29,Los Angeles County Public Works Waterworks  29,Los Angeles County Public Works works  29,Los Angeles County Public Works works  29,Los Angeles County Public Works works  29,Los Angeles  Public Works works  29,Los Angeles  Public Works works  29,Los Angeles  Public Works works  29,Los Angeles  Public Works works  29,Los Angeles   Works works  29,Los Angeles   Works works  29,Los Angeles   Works works  29,Los Angeles    works  29,Los Angeles      29,Los Angeles      29,Los Angeles      29,Los Angeles      29,Los Angeles      29Placer County Water Agency,Placer County Water Agency,Placer County Water Agency,Placer County  Agency,Placer County  Agency,Placer County  Agency,Placer   Agency,Placer   Agency,Placer   Agency,Placer   Agency,Placer   Agency,Placer   Agency,Placer   Agency,Placer   Agency,Placer   Agency,Placer   Agency,Placer   Agency,Placer   Agency,Placer   AgencyCorona  City of,Corona  City of,Corona  ,Corona  ,Corona  ,Corona  ,Corona  ,Corona  ,Corona  ,Corona  ,Corona  ,Corona  ,Corona  ,Corona  ,Corona  ,Corona  ,Corona  ,Corona  ,Corona  Burbank  City of,Burbank  City of,Burbank  ,Burbank  ,Burbank  ,Burbank  ,Burbank  ,Burbank  ,Burbank  ,Burbank  ,Burbank  ,Burbank  ,Burbank  ,Burbank  ,Burbank  ,Burbank  ,Burbank  ,Burbank  ,Burbank  Camarillo  City of,Camarillo  City of,Camarillo  ,Camarillo  ,Camarillo  ,Camarillo  ,Camarillo  ,Camarillo  ,Camarillo  ,Camarillo  ,Camarillo  ,Camarillo  ,Camarillo  ,Camarillo  ,Camarillo  ,Camarillo  ,Camarillo  ,Camarillo  ,Camarillo  Blythe  City of,Blythe  City of,Blythe  ,Blythe  ,Blythe  ,Blythe  ,Blythe  ,Blythe  ,Blythe  ,Blythe  ,Blythe  ,Blythe  ,Blythe  ,Blythe  ,Blythe  ,Blythe  ,Blythe  ,Blythe  ,Blythe  Roseville  City of,Roseville  City of,Roseville  ,Roseville  ,Roseville  ,Roseville  ,Roseville  ,Roseville  ,Roseville  ,Roseville  ,Roseville  ,Roseville  ,Roseville  ,Roseville  ,Roseville  ,Roseville  ,Roseville  ,Roseville  ,Roseville  Vista Irrigation District,Vista Irrigation ,Vista Irrigation ,Vista Irrigation ,Vista Irrigation ,Vista Irrigation ,Vista Irrigation ,Vista  ,Vista  ,Vista  ,Vista  ,Vista  ,Vista  ,Vista  ,Vista  ,Vista  ,Vista  ,Vista  ,Vista  West Valley Water District,West Valley Water ,West Valley Water ,West Valley  ,West Valley  ,West Valley  ,West Valley  ,West Valley  ,West Valley  ,West Valley  ,West Valley  ,West Valley  ,West Valley  ,West Valley  ,West Valley  ,West Valley  ,West Valley  ,West Valley  ,West Valley  Napa  City of,Napa  City of,Napa  ,Napa  ,Napa  ,Napa  ,Napa  ,Napa  ,Napa  ,Napa  ,Napa  ,Napa  ,Napa  ,Napa  ,Napa  ,Napa  ,Napa  ,Napa  ,Napa  Mission Springs Water District,Mission Springs Water ,Mission Springs Water ,Mission Springs  ,Mission Springs  ,Mission Springs  ,Mission Springs  ,Mission Springs  ,Mission Springs  ,Mission Springs  ,Mission Springs  ,Mission Springs  ,Mission Springs  ,Mission Springs  ,Mission Springs  ,Mission Springs  ,Mission Springs  ,Mission Springs  ,Mission Springs  Los Angeles County Public Works Waterworks District 40,Los Angeles County Public Works Waterworks  40,Los Angeles County Public Works Waterworks  40,Los Angeles County Public Works works  40,Los Angeles County Public Works works  40,Los Angeles County Public Works works  40,Los Angeles  Public Works works  40,Los Angeles  Public Works works  40,Los Angeles  Public Works works  40,Los Angeles  Public Works works  40,Los Angeles   Works works  40,Los Angeles   Works works  40,Los Angeles   Works works  40,Los Angeles    works  40,Los Angeles      40,Los Angeles      40,Los Angeles      40,Los Angeles      40,Los Angeles      40Nevada Irrigation District,Nevada Irrigation ,Nevada Irrigation ,Nevada Irrigation ,Nevada Irrigation ,Nevada Irrigation ,Nevada Irrigation ,Nevada  ,Nevada  ,Nevada  ,Nevada  ,Nevada  ,Nevada  ,Nevada  ,Nevada  ,Nevada  ,Nevada  ,Nevada  ,Nevada  Alameda County Water District,Alameda County Water ,Alameda County Water ,Alameda County  ,Alameda County  ,Alameda County  ,Alameda   ,Alameda   ,Alameda   ,Alameda   ,Alameda   ,Alameda   ,Alameda   ,Alameda   ,Alameda   ,Alameda   ,Alameda   ,Alameda   ,Alameda   Hawthorne  City of,Hawthorne  City of,Hawthorne  ,Hawthorne  ,Hawthorne  ,Hawthorne  ,Hawthorne  ,Hawthorne  ,Hawthorne  ,Hawthorne  ,Hawthorne  ,Hawthorne  ,Hawthorne  ,Hawthorne  ,Hawthorne  ,Hawthorne  ,Hawthorne  ,Hawthorne  ,Hawthorne  Nipomo Community Services District,Nipomo Community Services ,Nipomo Community Services ,Nipomo Community Services ,Nipomo Community Services ,Nipomo  Services ,Nipomo  Services ,Nipomo  Services ,Nipomo  Services ,Nipomo  Services ,Nipomo  Services ,Nipomo  Services ,Nipomo  Services ,Nipomo  Services ,Nipomo  Services ,Nipomo   ,Nipomo   ,Nipomo   ,Nipomo   Rancho California Water District,Rancho California Water ,Rancho California Water ,Rancho California  ,Rancho California  ,Rancho California  ,Rancho California  ,Rancho California  ,Rancho California  ,Rancho California  ,Rancho California  ,Rancho California  ,Rancho California  ,Rancho California  ,Rancho California  ,Rancho California  ,Rancho California  ,Rancho California  ,Rancho California  Rainbow Municipal Water District,Rainbow Municipal Water ,Rainbow Municipal Water ,Rainbow Municipal  ,Rainbow Municipal  ,Rainbow Municipal  ,Rainbow Municipal  ,Rainbow Municipal  ,Rainbow   ,Rainbow   ,Rainbow   ,Rainbow   ,Rainbow   ,Rainbow   ,Rainbow   ,Rainbow   ,Rainbow   ,Rainbow   ,Rainbow   