,,,,,,,,,,,,,,,,California Water Service,,Rubio Canyon Land and Water Association,Rubio Canyon Land and Water Association,Rubio Canyon Land and Water Association,Rubio Canyon Land and  Association,Rubio Canyon Land and  Association,Rubio Canyon Land and  Association,Rubio Canyon Land and  Association,Rubio Canyon Land and  Association,Rubio Canyon Land and  Association,Rubio Canyon Land and  Association,Rubio Canyon Land and  Association,Rubio Canyon Land and  Association,Rubio Canyon Land and  Association,Rubio Canyon Land and  Association,Rubio Canyon Land and  Association,Rubio Canyon Land and  Association,Rubio Canyon Land and  Association,Rubio Canyon Land and  Association,Rubio Canyon Land and  AssociationSanta Fe Springs  City of,Santa Fe Springs  City of,Santa Fe Springs  ,Santa Fe Springs  ,Santa Fe Springs  ,Santa Fe Springs  ,Santa Fe Springs  ,Santa Fe Springs  ,Santa Fe Springs  ,Santa Fe Springs  ,Santa Fe Springs  ,Santa Fe Springs  ,Santa Fe Springs  ,Santa Fe Springs  ,Santa Fe Springs  ,Santa Fe Springs  ,Santa Fe Springs  ,Santa Fe Springs  ,Santa Fe Springs  San Bernardino County Service Area 64,San Bernardino County Service Area 64,San Bernardino County Service Area 64,San Bernardino County Service Area 64,San Bernardino County Service Area 64,San Bernardino County Service Area 64,San Bernardino  Service Area 64,San Bernardino  Service Area 64,San Bernardino  Service Area 64,San Bernardino  Service Area 64,San Bernardino  Service Area 64,San Bernardino  Service Area 64,San Bernardino  Service Area 64,San Bernardino  Service Area 64,San Bernardino  Service Area 64,San Bernardino  Service Area 64,San Bernardino  Service Area 64,San Bernardino  Service Area 64,San Bernardino  Service Area 64Valley County Water District,Valley County Water ,Valley County Water ,Valley County  ,Valley County  ,Valley County  ,Valley   ,Valley   ,Valley   ,Valley   ,Valley   ,Valley   ,Valley   ,Valley   ,Valley   ,Valley   ,Valley   ,Valley   ,Valley   San Jacinto  City of,San Jacinto  City of,San Jacinto  ,San Jacinto  ,San Jacinto  ,San Jacinto  ,San Jacinto  ,San Jacinto  ,San Jacinto  ,San Jacinto  ,San Jacinto  ,San Jacinto  ,San Jacinto  ,San Jacinto  ,San Jacinto  ,San Jacinto  ,San Jacinto  ,San Jacinto  ,San Jacinto  San Gabriel County Water District,San Gabriel County Water ,San Gabriel County Water ,San Gabriel County  ,San Gabriel County  ,San Gabriel County  ,San Gabriel   ,San Gabriel   ,San Gabriel   ,San Gabriel   ,San Gabriel   ,San Gabriel   ,San Gabriel   ,San Gabriel   ,San Gabriel   ,San Gabriel   ,San Gabriel   ,San Gabriel   ,San Gabriel   Santa Ana  City of,Santa Ana  City of,Santa Ana  ,Santa Ana  ,Santa Ana  ,Santa Ana  ,Santa Ana  ,Santa Ana  ,Santa Ana  ,Santa Ana  ,Santa Ana  ,Santa Ana  ,Santa Ana  ,Santa Ana  ,Santa Ana  ,Santa Ana  ,Santa Ana  ,Santa Ana  ,Santa Ana  San Juan Capistrano  City of,San Juan Capistrano  City of,San Juan Capistrano  ,San Juan Capistrano  ,San Juan Capistrano  ,San Juan Capistrano  ,San Juan Capistrano  ,San Juan Capistrano  ,San Juan Capistrano  ,San Juan Capistrano  ,San Juan Capistrano  ,San Juan Capistrano  ,San Juan Capistrano  ,San Juan Capistrano  ,San Juan Capistrano  ,San Juan Capistrano  ,San Juan Capistrano  ,San Juan Capistrano  ,San Juan Capistrano  Serrano Water District,Serrano Water ,Serrano Water ,Serrano  ,Serrano  ,Serrano  ,Serrano  ,Serrano  ,Serrano  ,Serrano  ,Serrano  ,Serrano  ,Serrano  ,Serrano  ,Serrano  ,Serrano  ,Serrano  ,Serrano  ,Serrano  Sunny Slope Water Company,Sunny Slope Water Company,Sunny Slope Water Company,Sunny Slope  Company,Sunny Slope  Company,Sunny Slope  Company,Sunny Slope  Company,Sunny Slope  Company,Sunny Slope  Company,Sunny Slope  ,Sunny Slope  ,Sunny Slope  ,Sunny Slope  ,Sunny Slope  ,Sunny Slope  ,Sunny Slope  ,Sunny Slope  ,Sunny Slope  ,Sunny Slope  Sonoma  City of,Sonoma  City of,Sonoma  ,Sonoma  ,Sonoma  ,Sonoma  ,Sonoma  ,Sonoma  ,Sonoma  ,Sonoma  ,Sonoma  ,Sonoma  ,Sonoma  ,Sonoma  ,Sonoma  ,Sonoma  ,Sonoma  ,Sonoma  ,Sonoma  Sweetwater Authority,Sweetwater Authority,Sweetwater Authority,Sweetwater Authority,Sweetwater Authority,Sweetwater Authority,Sweetwater Authority,Sweetwater Authority,Sweetwater Authority,Sweetwater Authority,Sweetwater Authority,Sweetwater Authority,Sweetwater Authority,Sweetwater Authority,Sweetwater Authority,Sweetwater Authority,Sweetwater Authority,Sweetwater Authority,Sweetwater AuthoritySuburban Water Systems San Jose Hills,Suburban Water Systems San Jose Hills,Suburban Water Systems San Jose Hills,Suburban  Systems San Jose Hills,Suburban  Systems San Jose Hills,Suburban  Systems San Jose Hills,Suburban  Systems San Jose Hills,Suburban  Systems San Jose Hills,Suburban  Systems San Jose Hills,Suburban  Systems San Jose Hills,Suburban  Systems San Jose Hills,Suburban  Systems San Jose Hills,Suburban  Systems San Jose Hills,Suburban  Systems San Jose Hills,Suburban  Systems San Jose Hills,Suburban  Systems San Jose Hills,Suburban  Systems San Jose Hills,Suburban  Systems San Jose Hills,Suburban  Systems San Jose HillsUkiah  City of,Ukiah  City of,Ukiah  ,Ukiah  ,Ukiah  ,Ukiah  ,Ukiah  ,Ukiah  ,Ukiah  ,Ukiah  ,Ukiah  ,Ukiah  ,Ukiah  ,Ukiah  ,Ukiah  ,Ukiah  ,Ukiah  ,Ukiah  ,Ukiah  Arcadia  City of,Arcadia  City of,Arcadia  ,Arcadia  ,Arcadia  ,Arcadia  ,Arcadia  ,Arcadia  ,Arcadia  ,Arcadia  ,Arcadia  ,Arcadia  ,Arcadia  ,Arcadia  ,Arcadia  ,Arcadia  ,Arcadia  ,Arcadia  ,Arcadia  Suburban Water Systems Whittier/La Mirada,Suburban Water Systems Whittier/La Mirada,Suburban Water Systems Whittier/La Mirada,Suburban  Systems Whittier/La Mirada,Suburban  Systems Whittier/La Mirada,Suburban  Systems Whittier/La Mirada,Suburban  Systems Whittier/La Mirada,Suburban  Systems Whittier/La Mirada,Suburban  Systems Whittier/La Mirada,Suburban  Systems Whittier/La Mirada,Suburban  Systems Whittier/La Mirada,Suburban  Systems Whittier/La Mirada,Suburban  Systems Whittier/La Mirada,Suburban  Systems Whittier/La Mirada,Suburban  Systems Whittier/La Mirada,Suburban  Systems Whittier/La Mirada,Suburban  Systems Whittier/La Mirada,Suburban  Systems Whittier/La Mirada,Suburban  Systems Whittier/La MiradaGolden State Water Company Artesia,Golden State Water Company Artesia,Golden State Water Company Artesia,Golden State  Company Artesia,Golden State  Company Artesia,Golden State  Company Artesia,Golden State  Company Artesia,Golden State  Company Artesia,Golden State  Company Artesia,Golden State   Artesia,Golden State   Artesia,Golden State   Artesia,Golden State   Artesia,Golden State   Artesia,Golden State   Artesia,Golden State   Artesia,Golden State   Artesia,Golden State   Artesia,Golden State   ArtesiaGolden State Water Company Claremont,Golden State Water Company Claremont,Golden State Water Company Claremont,Golden State  Company Claremont,Golden State  Company Claremont,Golden State  Company Claremont,Golden State  Company Claremont,Golden State  Company Claremont,Golden State  Company Claremont,Golden State   Claremont,Golden State   Claremont,Golden State   Claremont,Golden State   Claremont,Golden State   Claremont,Golden State   Claremont,Golden State   Claremont,Golden State   Claremont,Golden State   Claremont,Golden State   ClaremontGolden State Water Company Bell-Bell Gardens,Golden State Water Company Bell-Bell Gardens,Golden State Water Company Bell-Bell Gardens,Golden State  Company Bell-Bell Gardens,Golden State  Company Bell-Bell Gardens,Golden State  Company Bell-Bell Gardens,Golden State  Company Bell-Bell Gardens,Golden State  Company Bell-Bell Gardens,Golden State  Company Bell-Bell Gardens,Golden State   Bell-Bell Gardens,Golden State   Bell-Bell Gardens,Golden State   Bell-Bell Gardens,Golden State   Bell-Bell Gardens,Golden State   Bell-Bell Gardens,Golden State   Bell-Bell Gardens,Golden State   Bell-Bell Gardens,Golden State   Bell-Bell Gardens,Golden State   Bell-Bell Gardens,Golden State   Bell-Bell GardensGolden State Water Company Florence Graham,Golden State Water Company Florence Graham,Golden State Water Company Florence Graham,Golden State  Company Florence Graham,Golden State  Company Florence Graham,Golden State  Company Florence Graham,Golden State  Company Florence Graham,Golden State  Company Florence Graham,Golden State  Company Florence Graham,Golden State   Florence Graham,Golden State   Florence Graham,Golden State   Florence Graham,Golden State   Florence Graham,Golden State   Florence Graham,Golden State   Florence Graham,Golden State   Florence Graham,Golden State   Florence Graham,Golden State   Florence Graham,Golden State   Florence GrahamGolden State Water Company Barstow,Golden State Water Company Barstow,Golden State Water Company Barstow,Golden State  Company Barstow,Golden State  Company Barstow,Golden State  Company Barstow,Golden State  Company Barstow,Golden State  Company Barstow,Golden State  Company Barstow,Golden State   Barstow,Golden State   Barstow,Golden State   Barstow,Golden State   Barstow,Golden State   Barstow,Golden State   Barstow,Golden State   Barstow,Golden State   Barstow,Golden State   Barstow,Golden State   BarstowGolden State Water Company Norwalk,Golden State Water Company Norwalk,Golden State Water Company Norwalk,Golden State  Company Norwalk,Golden State  Company Norwalk,Golden State  Company Norwalk,Golden State  Company Norwalk,Golden State  Company Norwalk,Golden State  Company Norwalk,Golden State   Norwalk,Golden State   Norwalk,Golden State   Norwalk,Golden State   Norwalk,Golden State   Norwalk,Golden State   Norwalk,Golden State   Norwalk,Golden State   Norwalk,Golden State   Norwalk,Golden State   NorwalkUpland  City of,Upland  City of,Upland  ,Upland  ,Upland  ,Upland  ,Upland  ,Upland  ,Upland  ,Upland  ,Upland  ,Upland  ,Upland  ,Upland  ,Upland  ,Upland  ,Upland  ,Upland  ,Upland  Golden State Water Company Simi Valley,Golden State Water Company Simi Valley,Golden State Water Company Simi Valley,Golden State  Company Simi Valley,Golden State  Company Simi Valley,Golden State  Company Simi Valley,Golden State  Company Simi Valley,Golden State  Company Simi Valley,Golden State  Company Simi Valley,Golden State   Simi Valley,Golden State   Simi Valley,Golden State   Simi Valley,Golden State   Simi Valley,Golden State   Simi Valley,Golden State   Simi Valley,Golden State   Simi Valley,Golden State   Simi Valley,Golden State   Simi Valley,Golden State   Simi ValleyGolden State Water Company Southwest,Golden State Water Company Southwest,Golden State Water Company Southwest,Golden State  Company Southwest,Golden State  Company Southwest,Golden State  Company Southwest,Golden State  Company Southwest,Golden State  Company Southwest,Golden State  Company Southwest,Golden State   Southwest,Golden State   Southwest,Golden State   Southwest,Golden State   Southwest,Golden State   Southwest,Golden State   Southwest,Golden State   Southwest,Golden State   Southwest,Golden State   Southwest,Golden State   SouthwestGolden State Water Company West Orange,Golden State Water Company West Orange,Golden State Water Company West Orange,Golden State  Company West Orange,Golden State  Company West Orange,Golden State  Company West Orange,Golden State  Company West Orange,Golden State  Company West Orange,Golden State  Company West Orange,Golden State   West Orange,Golden State   West Orange,Golden State   West Orange,Golden State   West Orange,Golden State   West Orange,Golden State   West Orange,Golden State   West Orange,Golden State   West Orange,Golden State   West Orange,Golden State   West OrangeGrover Beach  City of,Grover Beach  City of,Grover Beach  ,Grover Beach  ,Grover Beach  ,Grover Beach  ,Grover Beach  ,Grover Beach  ,Grover Beach  ,Grover Beach  ,Grover Beach  ,Grover Beach  ,Grover Beach  ,Grover Beach  ,Grover Beach  ,Grover Beach  ,Grover Beach  ,Grover Beach  ,Grover Beach  Coachella  City of,Coachella  City of,Coachella  ,Coachella  ,Coachella  ,Coachella  ,Coachella  ,Coachella  ,Coachella  ,Coachella  ,Coachella  ,Coachella  ,Coachella  ,Coachella  ,Coachella  ,Coachella  ,Coachella  ,Coachella  ,Coachella  Compton  City of,Compton  City of,Compton  ,Compton  ,Compton  ,Compton  ,Compton  ,Compton  ,Compton  ,Compton  ,Compton  ,Compton  ,Compton  ,Compton  ,Compton  ,Compton  ,Compton  ,Compton  ,Compton  Valley Water Company,Valley Water Company,Valley Water Company,Valley  Company,Valley  Company,Valley  Company,Valley  Company,Valley  Company,Valley  Company,Valley  ,Valley  ,Valley  ,Valley  ,Valley  ,Valley  ,Valley  ,Valley  ,Valley  ,Valley  Cucamonga Valley Water District,Cucamonga Valley Water ,Cucamonga Valley Water ,Cucamonga Valley  ,Cucamonga Valley  ,Cucamonga Valley  ,Cucamonga Valley  ,Cucamonga Valley  ,Cucamonga Valley  ,Cucamonga Valley  ,Cucamonga Valley  ,Cucamonga Valley  ,Cucamonga Valley  ,Cucamonga Valley  ,Cucamonga Valley  ,Cucamonga Valley  ,Cucamonga Valley  ,Cucamonga Valley  ,Cucamonga Valley  Desert Water Agency,Desert Water Agency,Desert Water Agency,Desert  Agency,Desert  Agency,Desert  Agency,Desert  Agency,Desert  Agency,Desert  Agency,Desert  Agency,Desert  Agency,Desert  Agency,Desert  Agency,Desert  Agency,Desert  Agency,Desert  Agency,Desert  Agency,Desert  Agency,Desert  AgencyLa Verne  City of,La Verne  City of,La Verne  ,La Verne  ,La Verne  ,La Verne  ,La Verne  ,La Verne  ,La Verne  ,La Verne  ,La Verne  ,La Verne  ,La Verne  ,La Verne  ,La Verne  ,La Verne  ,La Verne  ,La Verne  ,La Verne  Fullerton  City of,Fullerton  City of,Fullerton  ,Fullerton  ,Fullerton  ,Fullerton  ,Fullerton  ,Fullerton  ,Fullerton  ,Fullerton  ,Fullerton  ,Fullerton  ,Fullerton  ,Fullerton  ,Fullerton  ,Fullerton  ,Fullerton  ,Fullerton  ,Fullerton  Sierra Madre  City of,Sierra Madre  City of,Sierra Madre  ,Sierra Madre  ,Sierra Madre  ,Sierra Madre  ,Sierra Madre  ,Sierra Madre  ,Sierra Madre  ,Sierra Madre  ,Sierra Madre  ,Sierra Madre  ,Sierra Madre  ,Sierra Madre  ,Sierra Madre  ,Sierra Madre  ,Sierra Madre  ,Sierra Madre  ,Sierra Madre  Georgetown Divide Public Utilities District,Georgetown Divide Public Utilities ,Georgetown Divide Public Utilities ,Georgetown Divide Public Utilities ,Georgetown Divide Public Utilities ,Georgetown Divide Public Utilities ,Georgetown Divide Public Utilities ,Georgetown Divide Public Utilities ,Georgetown Divide Public Utilities ,Georgetown Divide Public Utilities ,Georgetown Divide  Utilities ,Georgetown Divide   ,Georgetown Divide   ,Georgetown Divide   ,Georgetown Divide   ,Georgetown Divide   ,Georgetown Divide   ,George Divide   ,George Divide   Norwalk City of,Norwalk City of,Norwalk ,Norwalk ,Norwalk ,Norwalk ,Norwalk ,Norwalk ,Norwalk ,Norwalk ,Norwalk ,Norwalk ,Norwalk ,Norwalk ,Norwalk ,Norwalk ,Norwalk ,Norwalk ,Norwalk Glendora  City of,Glendora  City of,Glendora  ,Glendora  ,Glendora  ,Glendora  ,Glendora  ,Glendora  ,Glendora  ,Glendora  ,Glendora  ,Glendora  ,Glendora  ,Glendora  ,Glendora  ,Glendora  ,Glendora  ,Glendora  ,Glendora  Santa Fe Irrigation District,Santa Fe Irrigation ,Santa Fe Irrigation ,Santa Fe Irrigation ,Santa Fe Irrigation ,Santa Fe Irrigation ,Santa Fe Irrigation ,Santa Fe  ,Santa Fe  ,Santa Fe  ,Santa Fe  ,Santa Fe  ,Santa Fe  ,Santa Fe  ,Santa Fe  ,Santa Fe  ,Santa Fe  ,Santa Fe  ,Santa Fe  Rosamond Community Service District,Rosamond Community Service ,Rosamond Community Service ,Rosamond Community Service ,Rosamond Community Service ,Rosamond  Service ,Rosamond  Service ,Rosamond  Service ,Rosamond  Service ,Rosamond  Service ,Rosamond  Service ,Rosamond  Service ,Rosamond  Service ,Rosamond  Service ,Rosamond  Service ,Rosamond  Service ,Rosamond  Service ,Rosamond  Service ,Rosamond  Service Park Water Company,Park Water Company,Park Water Company,Park  Company,Park  Company,Park  Company,Park  Company,Park  Company,Park  Company,Park  ,Park  ,Park  ,Park  ,Park  ,Park  ,Park  ,Park  ,Park  ,Park  Rio Linda - Elverta Community Water District,Rio Linda - Elverta Community Water ,Rio Linda - Elverta Community Water ,Rio Linda - Elverta Community  ,Rio Linda - Elverta Community  ,Rio Linda - Elverta   ,Rio Linda - Elverta   ,Rio Linda - Elverta   ,Rio Linda - Elverta   ,Rio Linda - Elverta   ,Rio Linda - Elverta   ,Rio Linda - Elverta   ,Rio Linda - Elverta   ,Rio Linda - Elverta   ,Rio Linda - Elverta   ,Rio Linda - Elverta   ,Rio Linda - Elverta   ,Rio Linda - Elverta   ,Rio Linda - Elverta   Padre Dam Municipal Water District,Padre Dam Municipal Water ,Padre Dam Municipal Water ,Padre Dam Municipal  ,Padre Dam Municipal  ,Padre Dam Municipal  ,Padre Dam Municipal  ,Padre Dam Municipal  ,Padre Dam   ,Padre Dam   ,Padre Dam   ,Padre Dam   ,Padre Dam   ,Padre Dam   ,Padre Dam   ,Padre Dam   ,Padre Dam   ,Padre Dam   ,Padre Dam   Millbrae  City of,Millbrae  City of,Millbrae  ,Millbrae  ,Millbrae  ,Millbrae  ,Millbrae  ,Millbrae  ,Millbrae  ,Millbrae  ,Millbrae  ,Millbrae  ,Millbrae  ,Millbrae  ,Millbrae  ,Millbrae  ,Millbrae  ,Millbrae  ,Millbrae  Groveland Community Services District,Groveland Community Services ,Groveland Community Services ,Groveland Community Services ,Groveland Community Services ,Groveland  Services ,Groveland  Services ,Groveland  Services ,Groveland  Services ,Groveland  Services ,Groveland  Services ,Groveland  Services ,Groveland  Services ,Groveland  Services ,Groveland  Services ,Groveland   ,Groveland   ,Groveland   ,Groveland   Paramount  City of,Paramount  City of,Paramount  ,Paramount  ,Paramount  ,Paramount  ,Paramount  ,Paramount  ,Paramount  ,Paramount  ,Paramount  ,Paramount  ,Paramount  ,Paramount  ,Paramount  ,Paramount  ,Paramount  ,Paramount  ,Paramount  Pasadena  City of,Pasadena  City of,Pasadena  ,Pasadena  ,Pasadena  ,Pasadena  ,Pasadena  ,Pasadena  ,Pasadena  ,Pasadena  ,Pasadena  ,Pasadena  ,Pasadena  ,Pasadena  ,Pasadena  ,Pasadena  ,Pasadena  ,Pasadena  ,Pasadena  Vernon  City of,Vernon  City of,Vernon  ,Vernon  ,Vernon  ,Vernon  ,Vernon  ,Vernon  ,Vernon  ,Vernon  ,Vernon  ,Vernon  ,Vernon  ,Vernon  ,Vernon  ,Vernon  ,Vernon  ,Vernon  ,Vernon  Pico Water District,Pico Water ,Pico Water ,Pico  ,Pico  ,Pico  ,Pico  ,Pico  ,Pico  ,Pico  ,Pico  ,Pico  ,Pico  ,Pico  ,Pico  ,Pico  ,Pico  ,Pico  ,Pico  Palo Alto  City of,Palo Alto  City of,Palo Alto  ,Palo Alto  ,Palo Alto  ,Palo Alto  ,Palo Alto  ,Palo Alto  ,Palo Alto  ,Palo Alto  ,Palo Alto  ,Palo Alto  ,Palo Alto  ,Palo Alto  ,Palo Alto  ,Palo Alto  ,Palo Alto  ,Palo Alto  ,Palo Alto  Rialto  City of,Rialto  City of,Rialto  ,Rialto  ,Rialto  ,Rialto  ,Rialto  ,Rialto  ,Rialto  ,Rialto  ,Rialto  ,Rialto  ,Rialto  ,Rialto  ,Rialto  ,Rialto  ,Rialto  ,Rialto  ,Rialto  Santa Paula  City of,Santa Paula  City of,Santa Paula  ,Santa Paula  ,Santa Paula  ,Santa Paula  ,Santa Paula  ,Santa Paula  ,Santa Paula  ,Santa Paula  ,Santa Paula  ,Santa Paula  ,Santa Paula  ,Santa Paula  ,Santa Paula  ,Santa Paula  ,Santa Paula  ,Santa Paula  ,Santa Paula  South Pasadena  City of,South Pasadena  City of,South Pasadena  ,South Pasadena  ,South Pasadena  ,South Pasadena  ,South Pasadena  ,South Pasadena  ,South Pasadena  ,South Pasadena  ,South Pasadena  ,South Pasadena  ,South Pasadena  ,South Pasadena  ,South Pasadena  ,South Pasadena  ,South Pasadena  ,South Pasadena  ,South Pasadena  Torrance  City of,Torrance  City of,Torrance  ,Torrance  ,Torrance  ,Torrance  ,Torrance  ,Torrance  ,Torrance  ,Torrance  ,Torrance  ,Torrance  ,Torrance  ,Torrance  ,Torrance  ,Torrance  ,Torrance  ,Torrance  ,Torrance  West Sacramento  City of,West Sacramento  City of,West Sacramento  ,West Sacramento  ,West Sacramento  ,West Sacramento  ,West Sacramento  ,West Sacramento  ,West Sacramento  ,West Sacramento  ,West Sacramento  ,West Sacramento  ,West Sacramento  ,West Sacramento  ,West Sacramento  ,West Sacramento  ,West Sacramento  ,West Sacramento  ,West Sacramento  Fallbrook Public Utility District,Fallbrook Public Utility ,Fallbrook Public Utility ,Fallbrook Public Utility ,Fallbrook Public Utility ,Fallbrook Public Utility ,Fallbrook Public Utility ,Fallbrook Public Utility ,Fallbrook Public Utility ,Fallbrook Public Utility ,Fallbrook  Utility ,Fallbrook  Utility ,Fallbrook  Utility ,Fallbrook  Utility ,Fallbrook  Utility ,Fallbrook  Utility ,Fallbrook  Utility ,Fallbrook  Utility ,Fallbrook  Utility Morgan Hill  City of,Morgan Hill  City of,Morgan Hill  ,Morgan Hill  ,Morgan Hill  ,Morgan Hill  ,Morgan Hill  ,Morgan Hill  ,Morgan Hill  ,Morgan Hill  ,Morgan Hill  ,Morgan Hill  ,Morgan Hill  ,Morgan Hill  ,Morgan Hill  ,Morgan Hill  ,Morgan Hill  ,Morgan Hill  ,Morgan Hill  Valley Center Municipal Water District,Valley Center Municipal Water ,Valley Center Municipal Water ,Valley Center Municipal  ,Valley Center Municipal  ,Valley Center Municipal  ,Valley Center Municipal  ,Valley Center Municipal  ,Valley Center   ,Valley Center   ,Valley Center   ,Valley Center   ,Valley Center   ,Valley Center   ,Valley Center   ,Valley Center   ,Valley Center   ,Valley Center   ,Valley Center   Beaumont-Cherry Valley Water District,Beaumont-Cherry Valley Water ,Beaumont-Cherry Valley Water ,Beaumont-Cherry Valley  ,Beaumont-Cherry Valley  ,Beaumont-Cherry Valley  ,Beaumont-Cherry Valley  ,Beaumont-Cherry Valley  ,Beaumont-Cherry Valley  ,Beaumont-Cherry Valley  ,Beaumont-Cherry Valley  ,Beaumont-Cherry Valley  ,Beaumont-Cherry Valley  ,Beaumont-Cherry Valley  ,Beaumont-Cherry Valley  ,Beaumont-Cherry Valley  ,Beaumont-Cherry Valley  ,Beaumont-Cherry Valley  ,Beaumont-Cherry Valley  Redwood City  City of,Redwood City  City of,Redwood City  ,Redwood City  ,Redwood City  ,Redwood City  ,Redwood City  ,Redwood City  ,Redwood City  ,Redwood City  ,Redwood City  ,Redwood City  ,Redwood City  ,Redwood City  ,Redwood City  ,Redwood City  ,Redwood City  ,Redwood City  ,Redwood City  Lemoore  City of,Lemoore  City of,Lemoore  ,Lemoore  ,Lemoore  ,Lemoore  ,Lemoore  ,Lemoore  ,Lemoore  ,Lemoore  ,Lemoore  ,Lemoore  ,Lemoore  ,Lemoore  ,Lemoore  ,Lemoore  ,Lemoore  ,Lemoore  ,Lemoore  Reedley  City of,Reedley  City of,Reedley  ,Reedley  ,Reedley  ,Reedley  ,Reedley  ,Reedley  ,Reedley  ,Reedley  ,Reedley  ,Reedley  ,Reedley  ,Reedley  ,Reedley  ,Reedley  ,Reedley  ,Reedley  ,Reedley  Golden State Water Company Cordova,Golden State Water Company Cordova,Golden State Water Company Cordova,Golden State  Company Cordova,Golden State  Company Cordova,Golden State  Company Cordova,Golden State  Company Cordova,Golden State  Company Cordova,Golden State  Company Cordova,Golden State   Cordova,Golden State   Cordova,Golden State   Cordova,Golden State   Cordova,Golden State   Cordova,Golden State   Cordova,Golden State   Cordova,Golden State   Cordova,Golden State   Cordova,Golden State   CordovaGolden State Water Company Bay Point,Golden State Water Company Bay Point,Golden State Water Company Bay Point,Golden State  Company Bay Point,Golden State  Company Bay Point,Golden State  Company Bay Point,Golden State  Company Bay Point,Golden State  Company Bay Point,Golden State  Company Bay Point,Golden State   Bay Point,Golden State   Bay Point,Golden State   Bay Point,Golden State   Bay Point,Golden State   Bay Point,Golden State   Bay Point,Golden State   Bay Point,Golden State   Bay Point,Golden State   Bay Point,Golden State   Bay PointGlendale  City of,Glendale  City of,Glendale  ,Glendale  ,Glendale  ,Glendale  ,Glendale  ,Glendale  ,Glendale  ,Glendale  ,Glendale  ,Glendale  ,Glendale  ,Glendale  ,Glendale  ,Glendale  ,Glendale  ,Glendale  ,Glendale  Fruitridge Vista Water Company,Fruitridge Vista Water Company,Fruitridge Vista Water Company,Fruitridge Vista  Company,Fruitridge Vista  Company,Fruitridge Vista  Company,Fruitridge Vista  Company,Fruitridge Vista  Company,Fruitridge Vista  Company,Fruitridge Vista  ,Fruitridge Vista  ,Fruitridge Vista  ,Fruitridge Vista  ,Fruitridge Vista  ,Fruitridge Vista  ,Fruitridge Vista  ,Fruitridge Vista  ,Fruitridge Vista  ,Fruitridge Vista  Golden State Water Company Culver City,Golden State Water Company Culver City,Golden State Water Company Culver City,Golden State  Company Culver City,Golden State  Company Culver City,Golden State  Company Culver City,Golden State  Company Culver City,Golden State  Company Culver City,Golden State  Company Culver City,Golden State   Culver City,Golden State   Culver City,Golden State   Culver City,Golden State   Culver City,Golden State   Culver City,Golden State   Culver City,Golden State   Culver City,Golden State   Culver City,Golden State   Culver City,Golden State   Culver CityGolden State Water Company S San Gabriel,Golden State Water Company S San Gabriel,Golden State Water Company S San Gabriel,Golden State  Company S San Gabriel,Golden State  Company S San Gabriel,Golden State  Company S San Gabriel,Golden State  Company S San Gabriel,Golden State  Company S San Gabriel,Golden State  Company S San Gabriel,Golden State   S San Gabriel,Golden State   S San Gabriel,Golden State   S San Gabriel,Golden State   S San Gabriel,Golden State   S San Gabriel,Golden State   S San Gabriel,Golden State   S San Gabriel,Golden State   S San Gabriel,Golden State   S San Gabriel,Golden State   S San GabrielGalt  City of,Galt  City of,Galt  ,Galt  ,Galt  ,Galt  ,Galt  ,Galt  ,Galt  ,Galt  ,Galt  ,Galt  ,Galt  ,Galt  ,Galt  ,Galt  ,Galt  ,Galt  ,Galt  Golden State Water Company Orcutt,Golden State Water Company Orcutt,Golden State Water Company Orcutt,Golden State  Company Orcutt,Golden State  Company Orcutt,Golden State  Company Orcutt,Golden State  Company Orcutt,Golden State  Company Orcutt,Golden State  Company Orcutt,Golden State   Orcutt,Golden State   Orcutt,Golden State   Orcutt,Golden State   Orcutt,Golden State   Orcutt,Golden State   Orcutt,Golden State   Orcutt,Golden State   Orcutt,Golden State   Orcutt,Golden State   OrcuttInglewood  City of,Inglewood  City of,Inglewood  ,Inglewood  ,Inglewood  ,Inglewood  ,Inglewood  ,Inglewood  ,Inglewood  ,Inglewood  ,Inglewood  ,Inglewood  ,Inglewood  ,Inglewood  ,Inglewood  ,Inglewood  ,Inglewood  ,Inglewood  ,Inglewood  