,,,,,,,,,,,,,,,,California Water Service,,Oceanside  City of,Oceanside  City of,Oceanside  ,Oceanside  ,Oceanside  ,Oceanside  ,Oceanside  ,Oceanside  ,Oceanside  ,Oceanside  ,Oceanside  ,Oceanside  ,Oceanside  ,Oceanside  ,Oceanside  ,Oceanside  ,Oceanside  ,Oceanside  ,Oceanside  Western Municipal Water District of Riverside,Western Municipal Water  of Riverside,Western Municipal Water  of Riverside,Western Municipal   of Riverside,Western Municipal   of Riverside,Western Municipal   of Riverside,Western Municipal   of Riverside,Western Municipal   of Riverside,Western    of Riverside,Western    of Riverside,Western    of Riverside,Western    of Riverside,Western    of Riverside,Western    of Riverside,Western    of Riverside,Western    of Riverside,Western    of Riverside,Western    of Riverside,Western     RiversideTahoe City Public Utilities District,Tahoe City Public Utilities ,Tahoe City Public Utilities ,Tahoe City Public Utilities ,Tahoe City Public Utilities ,Tahoe City Public Utilities ,Tahoe City Public Utilities ,Tahoe City Public Utilities ,Tahoe City Public Utilities ,Tahoe City Public Utilities ,Tahoe City  Utilities ,Tahoe City   ,Tahoe City   ,Tahoe City   ,Tahoe City   ,Tahoe City   ,Tahoe City   ,Tahoe City   ,Tahoe City   Calexico  City of,Calexico  City of,Calexico  ,Calexico  ,Calexico  ,Calexico  ,Calexico  ,Calexico  ,Calexico  ,Calexico  ,Calexico  ,Calexico  ,Calexico  ,Calexico  ,Calexico  ,Calexico  ,Calexico  ,Calexico  ,Calexico  Lompoc  City of,Lompoc  City of,Lompoc  ,Lompoc  ,Lompoc  ,Lompoc  ,Lompoc  ,Lompoc  ,Lompoc  ,Lompoc  ,Lompoc  ,Lompoc  ,Lompoc  ,Lompoc  ,Lompoc  ,Lompoc  ,Lompoc  ,Lompoc  ,Lompoc  California Water Service Company Bakersfield,California Water Service Company Bakersfield,California Water Service Company Bakersfield,California  Service Company Bakersfield,California  Service Company Bakersfield,California  Service Company Bakersfield,California  Service Company Bakersfield,California  Service Company Bakersfield,California  Service Company Bakersfield,California  Service  Bakersfield,California  Service  Bakersfield,California  Service  Bakersfield,California  Service  Bakersfield,California  Service  Bakersfield,California  Service  Bakersfield,California  Service  Bakersfield,  Bakersfield,  Bakersfield,  BakersfieldAmador Water Agency,Amador Water Agency,Amador Water Agency,Amador  Agency,Amador  Agency,Amador  Agency,Amador  Agency,Amador  Agency,Amador  Agency,Amador  Agency,Amador  Agency,Amador  Agency,Amador  Agency,Amador  Agency,Amador  Agency,Amador  Agency,Amador  Agency,Amador  Agency,Amador  AgencyCalifornia Water Service Company Oroville,California Water Service Company Oroville,California Water Service Company Oroville,California  Service Company Oroville,California  Service Company Oroville,California  Service Company Oroville,California  Service Company Oroville,California  Service Company Oroville,California  Service Company Oroville,California  Service  Oroville,California  Service  Oroville,California  Service  Oroville,California  Service  Oroville,California  Service  Oroville,California  Service  Oroville,California  Service  Oroville,  Oroville,  Oroville,  OrovilleTrabuco Canyon Water District,Trabuco Canyon Water ,Trabuco Canyon Water ,Trabuco Canyon  ,Trabuco Canyon  ,Trabuco Canyon  ,Trabuco Canyon  ,Trabuco Canyon  ,Trabuco Canyon  ,Trabuco Canyon  ,Trabuco Canyon  ,Trabuco Canyon  ,Trabuco Canyon  ,Trabuco Canyon  ,Trabuco Canyon  ,Trabuco Canyon  ,Trabuco Canyon  ,Trabuco Canyon  ,Trabuco Canyon  Otay Water District,Otay Water ,Otay Water ,Otay  ,Otay  ,Otay  ,Otay  ,Otay  ,Otay  ,Otay  ,Otay  ,Otay  ,Otay  ,Otay  ,Otay  ,Otay  ,Otay  ,Otay  ,Otay  Truckee-Donner Public Utilities District,Truckee-Donner Public Utilities ,Truckee-Donner Public Utilities ,Truckee-Donner Public Utilities ,Truckee-Donner Public Utilities ,Truckee-Donner Public Utilities ,Truckee-Donner Public Utilities ,Truckee-Donner Public Utilities ,Truckee-Donner Public Utilities ,Truckee-Donner Public Utilities ,Truckee-Donner  Utilities ,Truckee-Donner   ,Truckee-Donner   ,Truckee-Donner   ,Truckee-Donner   ,Truckee-Donner   ,Truckee-Donner   ,Truckee-Donner   ,Truckee-Donner   "Modesto, City of","Modesto, City of","Modesto, ","Modesto, ",Modesto ,Modesto ,Modesto ,Modesto ,Modesto ,Modesto ,Modesto ,Modesto ,Modesto ,Modesto ,Modesto ,Modesto ,Modesto ,Modesto ,Modesto Joshua Basin Water District,Joshua Basin Water ,Joshua Basin Water ,Joshua Basin  ,Joshua Basin  ,Joshua Basin  ,Joshua Basin  ,Joshua Basin  ,Joshua Basin  ,Joshua Basin  ,Joshua Basin  ,Joshua Basin  ,Joshua Basin  ,Joshua Basin  ,Joshua Basin  ,Joshua Basin  ,Joshua Basin  ,Joshua Basin  ,Joshua Basin  Santa Barbara  City of,Santa Barbara  City of,Santa Barbara  ,Santa Barbara  ,Santa Barbara  ,Santa Barbara  ,Santa Barbara  ,Santa Barbara  ,Santa Barbara  ,Santa Barbara  ,Santa Barbara  ,Santa Barbara  ,Santa Barbara  ,Santa Barbara  ,Santa Barbara  ,Santa Barbara  ,Santa Barbara  ,Santa Barbara  ,Santa Barbara  Tuolumne Utilities District,Tuolumne Utilities ,Tuolumne Utilities ,Tuolumne Utilities ,Tuolumne Utilities ,Tuolumne Utilities ,Tuolumne Utilities ,Tuolumne Utilities ,Tuolumne Utilities ,Tuolumne Utilities ,Tuolumne Utilities ,Tuolumne  ,Tuolumne  ,Tuolumne  ,Tuolumne  ,Tuolumne  ,Tuolumne  ,Tuolumne  ,Tuolumne  Sacramento County Water Agency,Sacramento County Water Agency,Sacramento County Water Agency,Sacramento County  Agency,Sacramento County  Agency,Sacramento County  Agency,Sacramento   Agency,Sacramento   Agency,Sacramento   Agency,Sacramento   Agency,Sacramento   Agency,Sacramento   Agency,Sacramento   Agency,Sacramento   Agency,Sacramento   Agency,Sacramento   Agency,Sacramento   Agency,Sacramento   Agency,Sacramento   AgencySan Buenaventura  City of,San Buenaventura  City of,San Buenaventura  ,San Buenaventura  ,San Buenaventura  ,San Buenaventura  ,San Buenaventura  ,San Buenaventura  ,San Buenaventura  ,San Buenaventura  ,San Buenaventura  ,San Buenaventura  ,San Buenaventura  ,San Buenaventura  ,San Buenaventura  ,San Buenaventura  ,San Buenaventura  ,San Buenaventura  ,San Buenaventura  Elk Grove Water Service,Elk Grove Water Service,Elk Grove Water Service,Elk Grove  Service,Elk Grove  Service,Elk Grove  Service,Elk Grove  Service,Elk Grove  Service,Elk Grove  Service,Elk Grove  Service,Elk Grove  Service,Elk Grove  Service,Elk Grove  Service,Elk Grove  Service,Elk Grove  Service,Elk Grove  Service,Elk Grove  Service,Elk Grove  Service,Elk Grove  ServiceNewhall County Water District,Newhall County Water ,Newhall County Water ,Newhall County  ,Newhall County  ,Newhall County  ,Newhall   ,Newhall   ,Newhall   ,Newhall   ,Newhall   ,Newhall   ,Newhall   ,Newhall   ,Newhall   ,Newhall   ,Newhall   ,Newhall   ,Newhall   Valencia Water Company,Valencia Water Company,Valencia Water Company,Valencia  Company,Valencia  Company,Valencia  Company,Valencia  Company,Valencia  Company,Valencia  Company,Valencia  ,Valencia  ,Valencia  ,Valencia  ,Valencia  ,Valencia  ,Valencia  ,Valencia  ,Valencia  ,Valencia  Castaic Lake Water Agency Santa Clarita Water Division,Castaic Lake Water Agency Santa Clarita Water Division,Castaic Lake Water Agency Santa Clarita Water Division,Castaic Lake  Agency Santa Clarita  Division,Castaic Lake  Agency Santa Clarita  Division,Castaic Lake  Agency Santa Clarita  Division,Castaic Lake  Agency Santa Clarita  Division,Castaic Lake  Agency Santa Clarita  Division,Castaic Lake  Agency Santa Clarita  Division,Castaic Lake  Agency Santa Clarita  Division,Castaic Lake  Agency Santa Clarita  Division,Castaic Lake  Agency Santa Clarita  Division,Castaic Lake  Agency Santa Clarita  Division,Castaic Lake  Agency Santa Clarita  Division,Castaic Lake  Agency Santa Clarita  Division,Castaic Lake  Agency Santa Clarita  Division,Castaic Lake  Agency Santa Clarita  Division,Castaic Lake  Agency Santa Clarita  Division,Castaic Lake  Agency Santa Clarita  DivisionCalifornia Water Service Company East Los Angeles,California Water Service Company East Los Angeles,California Water Service Company East Los Angeles,California  Service Company East Los Angeles,California  Service Company East Los Angeles,California  Service Company East Los Angeles,California  Service Company East Los Angeles,California  Service Company East Los Angeles,California  Service Company East Los Angeles,California  Service  East Los Angeles,California  Service  East Los Angeles,California  Service  East Los Angeles,California  Service  East Los Angeles,California  Service  East Los Angeles,California  Service  East Los Angeles,California  Service  East Los Angeles,  East Los Angeles,  East Los Angeles,  East Los AngelesExeter  City of,Exeter  City of,Exeter  ,Exeter  ,Exeter  ,Exeter  ,Exeter  ,Exeter  ,Exeter  ,Exeter  ,Exeter  ,Exeter  ,Exeter  ,Exeter  ,Exeter  ,Exeter  ,Exeter  ,Exeter  ,Exeter  "Rio Vista, city of","Rio Vista, city of","Rio Vista, city of","Rio Vista, city of",Rio Vista city of,Rio Vista city of,Rio Vista city of,Rio Vista city of,Rio Vista city of,Rio Vista city of,Rio Vista city of,Rio Vista city of,Rio Vista ,Rio Vista ,Rio Vista ,Rio Vista ,Rio Vista ,Rio Vista ,Rio Vista Sweetwater Springs Water District,Sweetwater Springs Water ,Sweetwater Springs Water ,Sweetwater Springs  ,Sweetwater Springs  ,Sweetwater Springs  ,Sweetwater Springs  ,Sweetwater Springs  ,Sweetwater Springs  ,Sweetwater Springs  ,Sweetwater Springs  ,Sweetwater Springs  ,Sweetwater Springs  ,Sweetwater Springs  ,Sweetwater Springs  ,Sweetwater Springs  ,Sweetwater Springs  ,Sweetwater Springs  ,Sweetwater Springs  California Water Service Company Visalia,California Water Service Company Visalia,California Water Service Company Visalia,California  Service Company Visalia,California  Service Company Visalia,California  Service Company Visalia,California  Service Company Visalia,California  Service Company Visalia,California  Service Company Visalia,California  Service  Visalia,California  Service  Visalia,California  Service  Visalia,California  Service  Visalia,California  Service  Visalia,California  Service  Visalia,California  Service  Visalia,  Visalia,  Visalia,  VisaliaCalifornia Water Service Company Selma,California Water Service Company Selma,California Water Service Company Selma,California  Service Company Selma,California  Service Company Selma,California  Service Company Selma,California  Service Company Selma,California  Service Company Selma,California  Service Company Selma,California  Service  Selma,California  Service  Selma,California  Service  Selma,California  Service  Selma,California  Service  Selma,California  Service  Selma,California  Service  Selma,  Selma,  Selma,  SelmaCalifornia Water Service Company Chico District,California Water Service Company Chico ,California Water Service Company Chico ,California  Service Company Chico ,California  Service Company Chico ,California  Service Company Chico ,California  Service Company Chico ,California  Service Company Chico ,California  Service Company Chico ,California  Service  Chico ,California  Service  Chico ,California  Service  Chico ,California  Service  Chico ,California  Service  Chico ,California  Service  Chico ,California  Service  Chico ,  Chico ,  Chico ,  Chico Soquel Creek Water District,Soquel Creek Water ,Soquel Creek Water ,Soquel Creek  ,Soquel Creek  ,Soquel Creek  ,Soquel Creek  ,Soquel Creek  ,Soquel Creek  ,Soquel Creek  ,Soquel Creek  ,Soquel Creek  ,Soquel Creek  ,Soquel Creek  ,Soquel Creek  ,Soquel Creek  ,Soquel Creek  ,Soquel Creek  ,Soquel Creek  East Valley Water District,East Valley Water ,East Valley Water ,East Valley  ,East Valley  ,East Valley  ,East Valley  ,East Valley  ,East Valley  ,East Valley  ,East Valley  ,East Valley  ,East Valley  ,East Valley  ,East Valley  ,East Valley  ,East Valley  ,East Valley  ,East Valley  California Water Service Company Bear Gulch,California Water Service Company Bear Gulch,California Water Service Company Bear Gulch,California  Service Company Bear Gulch,California  Service Company Bear Gulch,California  Service Company Bear Gulch,California  Service Company Bear Gulch,California  Service Company Bear Gulch,California  Service Company Bear Gulch,California  Service  Bear Gulch,California  Service  Bear Gulch,California  Service  Bear Gulch,California  Service  Bear Gulch,California  Service  Bear Gulch,California  Service  Bear Gulch,California  Service  Bear Gulch,  Bear Gulch,  Bear Gulch,  Bear GulchBuena Park  City of,Buena Park  City of,Buena Park  ,Buena Park  ,Buena Park  ,Buena Park  ,Buena Park  ,Buena Park  ,Buena Park  ,Buena Park  ,Buena Park  ,Buena Park  ,Buena Park  ,Buena Park  ,Buena Park  ,Buena Park  ,Buena Park  ,Buena Park  ,Buena Park  South Gate  City of,South Gate  City of,South Gate  ,South Gate  ,South Gate  ,South Gate  ,South Gate  ,South Gate  ,South Gate  ,South Gate  ,South Gate  ,South Gate  ,South Gate  ,South Gate  ,South Gate  ,South Gate  ,South Gate  ,South Gate  ,South Gate  Hillsborough  Town of,Hillsborough  Town of,Hillsborough  Town of,Hillsborough  Town of,Hillsborough  Town of,Hillsborough  Town of,Hillsborough  Town of,Hillsborough  Town of,Hillsborough  Town of,Hillsborough  Town of,Hillsborough  Town of,Hillsborough  Town of,Hillsborough  Town of,Hillsborough  Town of,Hillsborough  Town of,Hillsborough  Town of,Hillsborough  Town of,Hillsborough  Town of,Hillsborough  Town "California Water Service Company Dixon, City of","California Water Service Company Dixon, City of","California Water Service Company Dixon, ","California  Service Company Dixon, ",California  Service Company Dixon ,California  Service Company Dixon ,California  Service Company Dixon ,California  Service Company Dixon ,California  Service Company Dixon ,California  Service  Dixon ,California  Service  Dixon ,California  Service  Dixon ,California  Service  Dixon ,California  Service  Dixon ,California  Service  Dixon ,California  Service  Dixon ,  Dixon ,  Dixon ,  Dixon Redlands  City of,Redlands  City of,Redlands  ,Redlands  ,Redlands  ,Redlands  ,Redlands  ,Redlands  ,Redlands  ,Redlands  ,Redlands  ,Redlands  ,Redlands  ,Redlands  ,Redlands  ,Redlands  ,Redlands  ,Redlands  ,Redlands  San Juan Water District,San Juan Water ,San Juan Water ,San Juan  ,San Juan  ,San Juan  ,San Juan  ,San Juan  ,San Juan  ,San Juan  ,San Juan  ,San Juan  ,San Juan  ,San Juan  ,San Juan  ,San Juan  ,San Juan  ,San Juan  ,San Juan  Fountain Valley  City of,Fountain Valley  City of,Fountain Valley  ,Fountain Valley  ,Fountain Valley  ,Fountain Valley  ,Fountain Valley  ,Fountain Valley  ,Fountain Valley  ,Fountain Valley  ,Fountain Valley  ,Fountain Valley  ,Fountain Valley  ,Fountain Valley  ,Fountain Valley  ,Fountain Valley  ,Fountain Valley  ,Fountain Valley  ,Fountain Valley  California Water Service Company Dominguez,California Water Service Company Dominguez,California Water Service Company Dominguez,California  Service Company Dominguez,California  Service Company Dominguez,California  Service Company Dominguez,California  Service Company Dominguez,California  Service Company Dominguez,California  Service Company Dominguez,California  Service  Dominguez,California  Service  Dominguez,California  Service  Dominguez,California  Service  Dominguez,California  Service  Dominguez,California  Service  Dominguez,California  Service  Dominguez,  Dominguez,  Dominguez,  DominguezHayward  City of,Hayward  City of,Hayward  ,Hayward  ,Hayward  ,Hayward  ,Hayward  ,Hayward  ,Hayward  ,Hayward  ,Hayward  ,Hayward  ,Hayward  ,Hayward  ,Hayward  ,Hayward  ,Hayward  ,Hayward  ,Hayward  California Water Service Company Hermosa/Redondo,California Water Service Company Hermosa/Redondo,California Water Service Company Hermosa/Redondo,California  Service Company Hermosa/Redondo,California  Service Company Hermosa/Redondo,California  Service Company Hermosa/Redondo,California  Service Company Hermosa/Redondo,California  Service Company Hermosa/Redondo,California  Service Company Hermosa/Redondo,California  Service  Hermosa/Redondo,California  Service  Hermosa/Redondo,California  Service  Hermosa/Redondo,California  Service  Hermosa/Redondo,California  Service  Hermosa/Redondo,California  Service  Hermosa/Redondo,California  Service  Hermosa/Redondo,  Hermosa/Redondo,  Hermosa/Redondo,  Hermosa/RedondoCalifornia Water Service Company King City,California Water Service Company King City,California Water Service Company King City,California  Service Company King City,California  Service Company King City,California  Service Company King City,California  Service Company King City,California  Service Company King City,California  Service Company King City,California  Service  King City,California  Service  King City,California  Service  King City,California  Service  King City,California  Service  King City,California  Service  King City,California  Service  King City,  King City,  King City,  King CityYucaipa Valley Water District,Yucaipa Valley Water ,Yucaipa Valley Water ,Yucaipa Valley  ,Yucaipa Valley  ,Yucaipa Valley  ,Yucaipa Valley  ,Yucaipa Valley  ,Yucaipa Valley  ,Yucaipa Valley  ,Yucaipa Valley  ,Yucaipa Valley  ,Yucaipa Valley  ,Yucaipa Valley  ,Yucaipa Valley  ,Yucaipa Valley  ,Yucaipa Valley  ,Yucaipa Valley  ,Yucaipa Valley  San Bernardino  City of,San Bernardino  City of,San Bernardino  ,San Bernardino  ,San Bernardino  ,San Bernardino  ,San Bernardino  ,San Bernardino  ,San Bernardino  ,San Bernardino  ,San Bernardino  ,San Bernardino  ,San Bernardino  ,San Bernardino  ,San Bernardino  ,San Bernardino  ,San Bernardino  ,San Bernardino  ,San Bernardino  Sacramento  City of,Sacramento  City of,Sacramento  ,Sacramento  ,Sacramento  ,Sacramento  ,Sacramento  ,Sacramento  ,Sacramento  ,Sacramento  ,Sacramento  ,Sacramento  ,Sacramento  ,Sacramento  ,Sacramento  ,Sacramento  ,Sacramento  ,Sacramento  ,Sacramento  California Water Service Company Kern River Valley,California Water Service Company Kern River Valley,California Water Service Company Kern River Valley,California  Service Company Kern River Valley,California  Service Company Kern River Valley,California  Service Company Kern River Valley,California  Service Company Kern River Valley,California  Service Company Kern River Valley,California  Service Company Kern River Valley,California  Service  Kern River Valley,California  Service  Kern River Valley,California  Service  Kern River Valley,California  Service  Kern River Valley,California  Service  Kern River Valley,California  Service  Kern River Valley,California  Service  Kern River Valley,  Kern River Valley,  Kern River Valley,  Kern River ValleyCalifornia Water Service Company Los Altos/Suburban,California Water Service Company Los Altos/Suburban,California Water Service Company Los Altos/Suburban,California  Service Company Los Altos/Suburban,California  Service Company Los Altos/Suburban,California  Service Company Los Altos/Suburban,California  Service Company Los Altos/Suburban,California  Service Company Los Altos/Suburban,California  Service Company Los Altos/Suburban,California  Service  Los Altos/Suburban,California  Service  Los Altos/Suburban,California  Service  Los Altos/Suburban,California  Service  Los Altos/Suburban,California  Service  Los Altos/Suburban,California  Service  Los Altos/Suburban,California  Service  Los Altos/Suburban,  Los Altos/Suburban,  Los Altos/Suburban,  Los Altos/SuburbanHanford  City of,Hanford  City of,Hanford  ,Hanford  ,Hanford  ,Hanford  ,Hanford  ,Hanford  ,Hanford  ,Hanford  ,Hanford  ,Hanford  ,Hanford  ,Hanford  ,Hanford  ,Hanford  ,Hanford  ,Hanford  ,Hanford  California Water Service Company Livermore,California Water Service Company Livermore,California Water Service Company Livermore,California  Service Company Livermore,California  Service Company Livermore,California  Service Company Livermore,California  Service Company Livermore,California  Service Company Livermore,California  Service Company Livermore,California  Service  Livermore,California  Service  Livermore,California  Service  Livermore,California  Service  Livermore,California  Service  Livermore,California  Service  Livermore,California  Service  Livermore,  Livermore,  Livermore,  LivermoreWest Kern Water District,West Kern Water ,West Kern Water ,West Kern  ,West Kern  ,West Kern  ,West Kern  ,West Kern  ,West Kern  ,West Kern  ,West Kern  ,West Kern  ,West Kern  ,West Kern  ,West Kern  ,West Kern  ,West Kern  ,West Kern  ,West Kern  Paso Robles  City of,Paso Robles  City of,Paso Robles  ,Paso Robles  ,Paso Robles  ,Paso Robles  ,Paso Robles  ,Paso Robles  ,Paso Robles  ,Paso Robles  ,Paso Robles  ,Paso Robles  ,Paso Robles  ,Paso Robles  ,Paso Robles  ,Paso Robles  ,Paso Robles  ,Paso Robles  ,Paso Robles  Pismo Beach  City of,Pismo Beach  City of,Pismo Beach  ,Pismo Beach  ,Pismo Beach  ,Pismo Beach  ,Pismo Beach  ,Pismo Beach  ,Pismo Beach  ,Pismo Beach  ,Pismo Beach  ,Pismo Beach  ,Pismo Beach  ,Pismo Beach  ,Pismo Beach  ,Pismo Beach  ,Pismo Beach  ,Pismo Beach  ,Pismo Beach  California Water Service Company Marysville,California Water Service Company Marysville,California Water Service Company Marysville,California  Service Company Marysville,California  Service Company Marysville,California  Service Company Marysville,California  Service Company Marysville,California  Service Company Marysville,California  Service Company Marysville,California  Service  Marysville,California  Service  Marysville,California  Service  Marysville,California  Service  Marysville,California  Service  Marysville,California  Service  Marysville,California  Service  Marysville,  Marysville,  Marysville,  MarysvilleMadera  City of,Madera  City of,Madera  ,Madera  ,Madera  ,Madera  ,Madera  ,Madera  ,Madera  ,Madera  ,Madera  ,Madera  ,Madera  ,Madera  ,Madera  ,Madera  ,Madera  ,Madera  ,Madera  Hemet  City of,Hemet  City of,Hemet  ,Hemet  ,Hemet  ,Hemet  ,Hemet  ,Hemet  ,Hemet  ,Hemet  ,Hemet  ,Hemet  ,Hemet  ,Hemet  ,Hemet  ,Hemet  ,Hemet  ,Hemet  ,Hemet  California Water Service Company Mid Peninsula,California Water Service Company Mid Peninsula,California Water Service Company Mid Peninsula,California  Service Company Mid Peninsula,California  Service Company Mid Peninsula,California  Service Company Mid Peninsula,California  Service Company Mid Peninsula,California  Service Company Mid Peninsula,California  Service Company Mid Peninsula,California  Service  Mid Peninsula,California  Service  Mid Peninsula,California  Service  Mid Peninsula,California  Service  Mid Peninsula,California  Service  Mid Peninsula,California  Service  Mid Peninsula,California  Service  Mid Peninsula,  Mid Peninsula,  Mid Peninsula,  Mid PeninsulaCalifornia Water Service Company Palos Verdes,California Water Service Company Palos Verdes,California Water Service Company Palos Verdes,California  Service Company Palos Verdes,California  Service Company Palos Verdes,California  Service Company Palos Verdes,California  Service Company Palos Verdes,California  Service Company Palos Verdes,California  Service Company Palos Verdes,California  Service  Palos Verdes,California  Service  Palos Verdes,California  Service  Palos Verdes,California  Service  Palos Verdes,California  Service  Palos Verdes,California  Service  Palos Verdes,California  Service  Palos Verdes,  Palos Verdes,  Palos Verdes,  Palos Verdes"Colton, City of","Colton, City of","Colton, ","Colton, ",Colton ,Colton ,Colton ,Colton ,Colton ,Colton ,Colton ,Colton ,Colton ,Colton ,Colton ,Colton ,Colton ,Colton ,Colton California Water Service Company Redwood Valley,California Water Service Company Redwood Valley,California Water Service Company Redwood Valley,California  Service Company Redwood Valley,California  Service Company Redwood Valley,California  Service Company Redwood Valley,California  Service Company Redwood Valley,California  Service Company Redwood Valley,California  Service Company Redwood Valley,California  Service  Redwood Valley,California  Service  Redwood Valley,California  Service  Redwood Valley,California  Service  Redwood Valley,California  Service  Redwood Valley,California  Service  Redwood Valley,California  Service  Redwood Valley,  Redwood Valley,  Redwood Valley,  Redwood ValleyBrea  City of,Brea  City of,Brea  ,Brea  ,Brea  ,Brea  ,Brea  ,Brea  ,Brea  ,Brea  ,Brea  ,Brea  ,Brea  ,Brea  ,Brea  ,Brea  ,Brea  ,Brea  ,Brea  California Water Service Company Salinas District,California Water Service Company Salinas ,California Water Service Company Salinas ,California  Service Company Salinas ,California  Service Company Salinas ,California  Service Company Salinas ,California  Service Company Salinas ,California  Service Company Salinas ,California  Service Company Salinas ,California  Service  Salinas ,California  Service  Salinas ,California  Service  Salinas ,California  Service  Salinas ,California  Service  Salinas ,California  Service  Salinas ,California  Service  Salinas ,  Salinas ,  Salinas ,  Salinas Wasco  City of,Wasco  City of,Wasco  ,Wasco  ,Wasco  ,Wasco  ,Wasco  ,Wasco  ,Wasco  ,Wasco  ,Wasco  ,Wasco  ,Wasco  ,Wasco  ,Wasco  ,Wasco  ,Wasco  ,Wasco  ,Wasco  